{
  "project_id": "SYN-TWO",
  "as_of": "2026-09-26T17:40:06.507779Z",
  "sources": [
    "synthetic"
  ],
  "closed_sprints": 2,
  "cold_start": true,
  "sprints_needed": 1,
  "team_context": {
    "velocity_mean": 21.0,
    "velocity_variance": 98.0,
    "closed_sprints": 2,
    "mean_cycle_time_hours": 89.20000000000002,
    "spillover_rate": 0.23076923076923078,
    "reopen_rate": 0.0
  },
  "sprints": [
    {
      "sprint_id": "SYN-TWO-S3",
      "name": "Sprint 3",
      "started_at": "2026-09-23T09:00:00Z",
      "planned_end": "2026-10-07T09:00:00Z",
      "closed_at": null,
      "stories": 9,
      "committed_points": 32.0,
      "completed_points": null,
      "spilled_over": null
    },
    {
      "sprint_id": "SYN-TWO-S2",
      "name": "Sprint 2",
      "started_at": "2026-09-09T09:00:00Z",
      "planned_end": "2026-09-23T09:00:00Z",
      "closed_at": "2026-09-23T16:00:00Z",
      "stories": 10,
      "committed_points": 35.0,
      "completed_points": 28.0,
      "spilled_over": 1
    },
    {
      "sprint_id": "SYN-TWO-S1",
      "name": "Sprint 1",
      "started_at": "2026-08-26T09:00:00Z",
      "planned_end": "2026-09-09T09:00:00Z",
      "closed_at": "2026-09-09T16:00:00Z",
      "stories": 5,
      "committed_points": 24.0,
      "completed_points": 14.0,
      "spilled_over": 2
    }
  ]
}
